B1: LIEUX | C1: LIENS | D1: INTENTIONS | E1: SURFACE m²
B3: BAINS | D3: 100 ou 200 entrées | E3: =SUM(E4:E17) -> 2050
B4: stock linge | C4: réception, ext | E4: 30
B5: local poubelles | C5: ext, zone technique | E5: 30
B6: nettoyage | C6: zone humide tempérée, zone technique | E6: 10
B7: local personnel (wc, douches, salle de repos, cuisine) | C7: réception, ext | E7: 80
B8: zone technique | C8: toutes zones | D8: machinerie, circulations
B9: réception | C9: stock linge, vestiaires, ext | E9: 60
B10: wc clients | C10: vestiaires, douches, zs, zht | E10: 60
B11: vestiaires | C11: réception, wc, zs, douches | D11: transparence int/ext | E11: 200
B12: zone sèche | C12: vestiaires, douches, wc | D12: salle de repos et salon de thé | E12: 200
B13: douches | C13: zs, zht,wc, vestiaires | E13: 100
B14: zone humide tempérée | C14: douches, zhc, ze, nettoyage | D14: zone principale labyrinthique, avec grand bain tempéré et bain intérieur/extérieur | E14: 1000
B15: zone humide chaude | C15: zht, étuve | D15: dalle chaude, alcôves de lavage | E15: 100
B16: étuve | C16: zhc | D16: très chaud et bain froid | E16: 30
B17: zone extérieure | C17: zht | D17: bain int/ext, bain d'air, petits bains très chauds | E17: 150
B19: LAVERIE | E19: =SUM(E20:E29) -> 260
B20: réception | C20: zone tampon, bureau | E20: 60
B21: linge sale | C21: zone tampon, lavage/séchage | E21: 20
B22: lavage, séchage | C22: linge sale, repassage | E22: 50
B23: repassage | C23: lavage, linge propre | E23: 50
B24: linge propre | C24: zone tampon, repassage | E24: 20
B25: bureau | C25: réception | E25: 10
B26: vestiare | C26: zone tampon | E26: 20
B27: wc | C27: zone tampon | E27: 10
B28: nettoyage | C28: zone tampon | E28: 10
B29: zone tampon | C29: réception, propre, sale, nettoyage, wc, vestiaire | E29: 10
B31: RESTAURANT | D31: 80 couverts | E31: =SUM(E32+E39+E44) -> 905
B32: cuisines | E32: 200
B33: stockage produits | C33: arrivée, préparation
B34: préparation des produits | C34: stock, cuisson, déchets
B35: cuisson | C35: préparation, déchets, stock vaisselle, plonge
B36: déchets | C36: ext, stock produits, arrivée, préparation, cuisson, plonge
B37: plonge | C37: stock vaisselle, cuisson, déchets
B38: stock vaisselle | C38: cuisson, plonge
B39: autres | E39: =SUM(E40:E43) -> 305
B40: arrivée des marchandises | C40: ext, stock produits, déchets | E40: 15
B41: local personnel (wc, douche, vestiaire, repos | C41: ext, cuisine, salle | E41: 80
B42: bureaux | C42: local personnel, salle, cuisine | E42: 200
B43: nettoyage | C43: salle, cuisine | E43: 10
B44: salle | E44: =SUM(E45:E51) -> 400
B45: salle à manger fumeur | C45: entrée, bar, wc | E45: 100
B46: salle à manger non fumeur | C46: entrée, bar, wc | E46: 100
B47: stock limonade | C47: bar, salle à manger | E47: 20
B48: bar | C48: salles à manger, entrée, wc | E48: 100
B49: entrée | C49: salles à manger, bar, vestiaire | E49: 20
B50: vestiaire | C50: entrée | E50: 10
B51: wc | C51: salles à manger, bar | D51: toilettes de luxe! | E51: 50
B53: PUB | D53: 80 personnes environ | E53: =SUM(E54:E63) -> 245
B54: salle à boire | C54: ext, bar, wc | E54: 100
B55: bar | C55: salle, cuisine, stock, déchets, local personnel | E55: 20
B56: cuisine | C56: bar, déchets, stocks | E56: 10
B57: stock limonade | C57: bar, ext | E57: 30
B58: stock nourriture | C58: ext, cuisine | E58: 10
B59: déchets | C59: ext, bar, cuisine | E59: 10
B60: stock vaisselle | C60: bar, cuisine | E60: 10
B61: wc | C61: salle | E61: 30
B62: local personnel | C62: ext, bar | E62: 20
B63: nettoyage | C63: wc | E63: 5
B65: HABITAT CONSOMMABLE | D65: 60 logements environ | E65: =SUM(E66:E78) -> 7655
B66: réception | C66: ext, bureau commercial, concierge, showroom, circulations, nettoyage | E66: 50
B67: bureau commercial | C67: réception | E67: 10
B68: concierge | C68: réception | E68: 80
B69: showroom | C69: réception, bureau commercial | E69: 50
B70: déchets | C70: ext | E70: 60
B71: local vélo | C71: ext | E71: 60
B72: nettoyage | C72: réception | E72: 10
B73: local personnel | C73: réception | E73: 35
B74: circulations | D74: 2 ascenseurs, monte charge, 2 escaliers
B75: ateliers | C75: stocks, ext | E75: 200
B76: stock matériaux | C76: ateliers, ext | E76: 800
B77: plateaux de logements | C77: réception, débarras, déchets | E77: 6000
B78: débarras | C78: plateaux de logements | E78: 300
B80: QUASI-HOTEL | D80: 100 chambres environ | E80: =SUM(E81:E88)+E90 -> 5000
B81: réception | C81: ext, pub, réceptionniste, nettoyage, casiers, espace commun,bureaux | E81: 50
B82: bureaux | C82: réception | E82: 50
B83: local réceptionniste (wc, douche, chambre) | C83: réception | E83: 20
B84: nettoyage | C84: réception | E84: 50
B85: local personnel (vestiaire, wc, douche, salle de repos) | C85: réception | E85: 80
B86: stock des casiers | C86: réception | E86: 300
B87: stockage linge | C87: chambres, espace commun | E87: 50
B88: chambres | C88: espace commun | E88: 2000
B90: total commun | E90: 2400
B91: espace commun | C91: réception, chambres, office, fumoir, salle télé, micro-cuisine | D91: micro-amménagements visant la convivialité
B92: office petit-déjeuner | C92: espace commun | D92: ouvert sur l'espace commun, on prend son petit-dèj où on veut
B93: fumoir | C93: espace commun
B94: salle télé | C94: espace commun
B95: micro-cuisine | C95: espace commun